{
  "template_id": "replace-me",
  "template_version": "1.1.0",
  "supported_schema": "1.1",
  "template_sha256": "REPLACE_WITH_64_LOWERCASE_HEX",
  "source_template_sha256": "REPLACE_WITH_64_LOWERCASE_HEX",
  "text_slots": {},
  "dynamic_lesson_table": {
    "main_table_index": 0,
    "container_row": 5,
    "container_col": 0,
    "min_rows": 1,
    "max_rows": 6,
    "max_images_per_row": 4,
    "row_height_cm": 5.8,
    "image_box_cm": {},
    "title_style": {},
    "body_style": {}
  },
  "training_record_policy": "leave_blank",
  "forbidden_markers": ["{{", "}}"],
  "layout_invariants": [],
  "visual_check_required": false
}
